{"response_type":"batch","batch_number":3,"bootstrap":{"nodes":[],"edges":[],"rationale":""},"cases":[{"problem_id":47,"framing":"Create a recognizable musical identity whose essential relationships survive contrasting orchestral and electronic realizations.","new_nodes":[{"temp_id":"b3-theme","name":"Cross-Arrangement Theme Composition","kind":"composite","capability":"Compose musical identity that remains recognizable and expressive across materially different arrangements.","accepts":"Expressive intent, motif possibilities, target arrangement families, and performance constraints.","produces":"A theme with invariant identity and adaptable realization.","boundary":"Owns theme-level portability across arrangements.","excludes":"Fully orchestrating each finished arrangement."},{"temp_id":"b3-adapt","name":"Arrangement Adaptability","kind":"solver","capability":"Preserve musical function while rhythm, harmony, texture, articulation, and timbre change.","accepts":"A theme, identity invariants, arrangement media, and transformation options.","produces":"Compatible transformation rules for contrasting realizations.","boundary":"Owns permissible variation around thematic identity.","excludes":"Choosing the theme's expressive meaning."}],"topology_edges":[{"kind":"specialization","parent_ref":"solver-0108","child_ref":"b3-theme","role":"Create expression through arrangement-portable music.","rationale":"The theme is standalone expression, not necessarily narrative scoring."},{"kind":"composition","parent_ref":"b3-theme","child_ref":"solver-0112","role":"Preserve recognizable thematic identity.","rationale":"Portability fails if transformations erase identity."},{"kind":"composition","parent_ref":"b3-theme","child_ref":"b3-adapt","role":"Enable contrasting sonic realizations.","rationale":"Identity must tolerate medium-specific transformation."}],"abstraction_ascent":[{"node_ref":"b3-theme","why_more_general":"Expression Creation includes musical and nonmusical interpretable forms.","reframing_effect":"Separates enduring expressive form from arrangement implementation."},{"node_ref":"solver-0108","why_more_general":"RootSolver also resolves instrumental, epistemic, and other non-expressive problems.","reframing_effect":"Places artistic creation beside fundamentally different resolution modes."},{"node_ref":"solver-0001","why_more_general":"It is the universal problem-solving boundary.","reframing_effect":"Activates the complete resolution scaffold."}],"invocations":[{"id":"47r","parent_id":"ROOT","node_ref":"solver-0001","edge_kind":"root","role":"Resolve the composition problem.","contribution":"Integrates expressive design and practical validation."},{"id":"47a","parent_id":"47r","node_ref":"solver-0108","edge_kind":"specialization","role":"Route through expression creation.","contribution":"Centers interpretable musical form."},{"id":"47b","parent_id":"47a","node_ref":"b3-theme","edge_kind":"specialization","role":"Design the portable theme.","contribution":"Integrates identity with adaptability."},{"id":"47p","parent_id":"47r","node_ref":"solver-0002","edge_kind":"composition","role":"Constitute the brief.","contribution":"Defines media, audience, and success."},{"id":"47e","parent_id":"47r","node_ref":"solver-0006","edge_kind":"composition","role":"Explain perceptual continuity.","contribution":"Models which features carry recognition."},{"id":"47s","parent_id":"47r","node_ref":"solver-0010","edge_kind":"composition","role":"Generate theme candidates.","contribution":"Explores contrasting invariant structures."},{"id":"47c","parent_id":"47r","node_ref":"solver-0014","edge_kind":"composition","role":"Select a theme.","contribution":"Balances identity, emotion, and flexibility."},{"id":"47x","parent_id":"47r","node_ref":"solver-0018","edge_kind":"composition","role":"Realize both arrangements.","contribution":"Produces orchestral and electronic demonstrations."},{"id":"47g","parent_id":"47r","node_ref":"solver-0022","edge_kind":"composition","role":"Test cross-media recognition.","contribution":"Revises transformations after listening evidence."},{"id":"47i","parent_id":"47b","node_ref":"solver-0112","edge_kind":"composition","role":"Anchor identity.","contribution":"Defines memorable intervallic and rhythmic invariants."},{"id":"47d","parent_id":"47b","node_ref":"b3-adapt","edge_kind":"composition","role":"Permit transformation.","contribution":"Maps invariants into each medium."}],"revisions":[],"synthesis":"A portable theme emerges when a small identity-bearing core governs broad, medium-specific transformation.","proposed_solution":"Write a short contour-and-rhythm cell with flexible harmony. Demonstrate it once through orchestral counterpoint and once through electronic pulse, preserving contour landmarks and phrase cadence while changing timbre, density, articulation, and harmonic color."},{"problem_id":52,"framing":"Establish legitimate, developmentally responsive household boundaries balancing adolescent agency, wellbeing, relationships, and digital participation.","new_nodes":[{"temp_id":"b3-family-boundary","name":"Developmental Household Boundary Design","kind":"abstraction_parent","capability":"Design household rules that protect development while progressively transferring judgment and autonomy.","accepts":"Developmental needs, family values, risks, routines, relationships, and growing agency.","produces":"Legitimate, revisable boundaries matched to maturity and evidence.","boundary":"Owns household authority during progressive autonomy.","excludes":"Punitive control or clinical treatment."},{"temp_id":"b3-screen","name":"Teen Screen-Boundary Design","kind":"composite","capability":"Configure screen boundaries supporting wellbeing, responsibilities, relationships, participation, and growing self-regulation.","accepts":"Teen needs, uses, routines, risks, family constraints, and observed effects.","produces":"A negotiated screen agreement with safeguards and revision triggers.","boundary":"Owns recurring household screen-use boundaries.","excludes":"Surveillance unrelated to demonstrated risk."}],"topology_edges":[{"kind":"specialization","parent_ref":"solver-0027","child_ref":"b3-family-boundary","role":"Govern household conduct through legitimate developmental rules.","rationale":"Rules coordinate collective life while authority progressively changes."},{"kind":"specialization","parent_ref":"b3-family-boundary","child_ref":"b3-screen","role":"Apply developmental boundaries to screen use.","rationale":"Screen use is one recurring autonomy-and-safety boundary."},{"kind":"composition","parent_ref":"b3-screen","child_ref":"solver-0117","role":"Develop transferable self-regulation.","rationale":"Durable boundaries must become internal capability."},{"kind":"composition","parent_ref":"b3-screen","child_ref":"solver-0119","role":"Clarify authority and exceptions.","rationale":"Unclear decision rights make boundaries arbitrary."},{"kind":"composition","parent_ref":"b3-screen","child_ref":"solver-0086","role":"Protect whole-person development.","rationale":"Sleep, learning, relationships, and agency must remain jointly viable."}],"abstraction_ascent":[{"node_ref":"b3-screen","why_more_general":"Developmental household boundaries govern many autonomy-and-safety domains.","reframing_effect":"Treats screens as one negotiated developmental boundary."},{"node_ref":"b3-family-boundary","why_more_general":"Institutional design covers durable rules beyond households and development.","reframing_effect":"Makes legitimacy, authority, incentives, and revision visible."},{"node_ref":"solver-0027","why_more_general":"System Shaping also includes physical, software, ecological, and service systems.","reframing_effect":"Frames family rules as one system-shaping mechanism."},{"node_ref":"solver-0026","why_more_general":"RootSolver includes explanation, knowledge formation, and expression creation.","reframing_effect":"Distinguishes structural intervention from other resolution modes."},{"node_ref":"solver-0001","why_more_general":"It contains every kind of problem resolution.","reframing_effect":"Activates universal problem-solving dimensions."}],"invocations":[{"id":"52r","parent_id":"ROOT","node_ref":"solver-0001","edge_kind":"root","role":"Resolve screen-boundary conflict.","contribution":"Integrates development, legitimacy, and adaptation."},{"id":"52a","parent_id":"52r","node_ref":"solver-0026","edge_kind":"specialization","role":"Route through system shaping.","contribution":"Treats patterns and rules as interacting."},{"id":"52b","parent_id":"52a","node_ref":"solver-0027","edge_kind":"specialization","role":"Route through institutional design.","contribution":"Centers durable household rules."},{"id":"52c","parent_id":"52b","node_ref":"b3-family-boundary","edge_kind":"specialization","role":"Use developmental governance.","contribution":"Balances protection with transferred autonomy."},{"id":"52d","parent_id":"52c","node_ref":"b3-screen","edge_kind":"specialization","role":"Design screen boundaries.","contribution":"Integrates uses, harms, and responsibilities."},{"id":"52p","parent_id":"52r","node_ref":"solver-0002","edge_kind":"composition","role":"Constitute the concern.","contribution":"Defines observed harms and valued freedoms."},{"id":"52e","parent_id":"52r","node_ref":"solver-0006","edge_kind":"composition","role":"Explain current patterns.","contribution":"Separates displacement effects from screen duration."},{"id":"52s","parent_id":"52r","node_ref":"solver-0010","edge_kind":"composition","role":"Create agreement options.","contribution":"Combines limits, zones, and exceptions."},{"id":"52k","parent_id":"52r","node_ref":"solver-0014","edge_kind":"composition","role":"Adopt legitimate boundaries.","contribution":"Secures teen and caregiver ownership."},{"id":"52x","parent_id":"52r","node_ref":"solver-0018","edge_kind":"composition","role":"Embed the agreement.","contribution":"Configures devices, routines, an